<?xml version="1.0" encoding="UTF-8" ?>
<!DOCTYPE mapper
        PUBLIC "-//mybatis.org//DTD Mapper 4.0//EN"
        "http://mybatis.org/dtd/mybatis-4-mapper.dtd">
<mapper namespace="users" application="rtomde">

    <parameterMap id="UserParamMap" type="cn.sliew.rtomde.UserParam">
        <parameter property="id" javaType="long"/>
    </parameterMap>

    <resultMap id="UserResultMap" type="cn.sliew.rtomde.UserDTO">
        <result column="id" property="id" javaType="long"/>
        <result column="username" property="username" javaType="string"/>
        <result column="password" property="password" javaType="string"/>
        <result column="nickname" property="nickname" javaType="string"/>
        <result column="email" property="email" javaType="string"/>
        <result column="phone" property="phone" javaType="string"/>
        <result column="deleted" property="deleted" javaType="integer"/>
        <result column="create_time" property="createTime" javaType="date"/>
        <result column="creator" property="creator" javaType="string"/>
        <result column="update_time" property="updateTime" javaType="date"/>
        <result column="updater" property="updater" javaType="string"/>
        <result column="comments" property="comments" javaType="string"/>
    </resultMap>

    <sql id="Base_Column_List">
        id, username, `password`, nickname, email, phone, deleted, create_time, creator,
        update_time, updater, comments
    </sql>

    <select id="selectByPrimaryKey" dataSourceId="rtomde" parameterMap="UserParamMap" resultMap="UserResultMap">
        select <include refid="Base_Column_List"/>
        from sys_user
        where id = #{id}
    </select>
</mapper>